objectid,title,creator,date,description,subject,image_citation,location,latitude,longitude,source,identifier,type,format,language,rights,rightsstatement,display_template,object_location,image_small,image_thumb,image_alt_text,object_transcript
make_believe_001,"Administration Building, University of Idaho, No. 30",Pacific Photo Co.,1910,"Example locally hosted image item. Photographic postcard of the University of Idaho administration building in Moscow, Idaho.",universities; buildings; campuses; picture postcards,"“Spokane ‘The Playground of the Nation,’” _Algemeen Handelsblad_ (Amsterdam), evening ed., January 31, 1931, Koninklijke Bibliotheek, Delpher, PPN 832337900, accessed December 3, 2025, https://www.delpher.nl/.","Moscow, Idaho",46.725562,-117.009633,"PG 9, Postcard Collection, Special Collections and Archives, University of Idaho Library",pg_9_12_01bl,Image;StillImage,image/jpeg,eng,,http://rightsstatements.org/vocab/NoC-US/1.0/,image,/objects/make_believe_001.jpg,/objects/small/make_believe_001_sm.jpg,/objects/thumbs/make_believe_001_th.jpg,historic sepia photograph depicting a formal brick and stone building in the College Gothic style,
make_believe_002,"Spokane County Court House, Spokane, Washington",Spokane Post Card Co.,1912-09-08,"Example locally hosted PDF item. Postcard is of the Spokane County Courthouse in Spokane, Washington. Postmark 9/8/1912, Spokane, WA. Destination San Francisco, CA.",public buildings; county courthouses; trees; picture postcards,"“Spokane in Ashes,” _East Washingtonian_ (Pomeroy, WA), August 10, 1889, 3, accessed December 3, 2025, https://washingtondigitalnewspapers.org/?a=d&d=ESTWSHTN18890810.2.28.","Spokane, Washington",47.66432,-117.428031,"PG 107, Knowles Postcard Collection, Special Collections and Archives, University of Idaho Library",Postcard_032,Image;StillImage,application/pdf,eng,,http://rightsstatements.org/vocab/NoC-US/1.0/,image,/objects/make_believe_002.jpg,/objects/small/make_believe_002_sm.jpg,/objects/thumbs/make_believe_002_th.jpg,historic colorized postcard depicting a formal building with a large central tower in the French Renaissance revival style,
make_believe_003,Good News – Power (radio episode),Frank B. Robinson,1947,Example locally hosted audio item. Psychiana radio program episode begins with assurance that there is a Power that can get people what they desire. Robinson then discusses his early life failures and childhood seeking of some force that could turn his failures into success. He asserts the God-Power can turn our failures into success and bring us material and spiritual abundance.,Frank B. Robinson; Failure; Success; Material Abundance,"Robert B. Hyslop, _Spokane Fire, 1889 (#24)_, photograph, Spokane Public Library, Northwest Room, accessed January 24, 2026, https://lange.spokanelibrary.org/items/show/2658.","Moscow, Idaho",46.733001,-116.991779,"Psychiana Digital Collection, Digital Initiatives, University of Idaho Library, https://www.lib.uidaho.edu/digital/psychiana/",Good_News_08,Image;StillImage,audio/mpeg,eng,"In Copyright - Educational Use Permitted. For more information, please contact University of Idaho Library Special Collections and Archives Department at libspec@uidaho.edu.",http://rightsstatements.org/vocab/InC-EDU/1.0/,image,/objects/make_believe_003.jpg,/objects/small/make_believe_003_sm.jpg,/objects/thumbs/make_believe_003_th.jpg,"portrait of a thoughtful man in a suit, with the text 'the amazing story of Psychiana' in green letters below",
make_believe_004,"University of Idaho vs. University of Southern California (Football), 10/30/1925",Vandal Athletics,1925-10-30,"Example YouTube video item. Idaho Football vs. University of Southern California 10/30/1925 at Neale Stadium in Moscow, ID. Score: 7 - 51 (L).",American Football,"County Deed Records, 1893–97. _Hypotheekbank property ownership noted on business district map of Spokane_. From 1925 map, Spokane City Engineer.","Moscow, Idaho",46.726113,-117.015671,"Vandal Video Collection, Digital Initiatives, University of Idaho Library, https://www.lib.uidaho.edu/digital/vandalvideo/","MG 23, Item 29",Image;StillImage,video/mp4,eng,"In Copyright - Educational Use Permitted. For more information, please contact University of Idaho Library Special Collections and Archives Department at libspec@uidaho.edu.",http://rightsstatements.org/vocab/InC-EDU/1.0/,image,/objects/make_believe_004.jpg,/objects/small/make_believe_004_sm.jpg,/objects/thumbs/make_believe_004_th.jpg,grainy image from historic film depicting fans heading to football game,
make_believe_005,Interview with K. Silem Mohammad,Devin Becker,2014-06-16,Example Vimeo video item. Oral history interview with poet K. Silem Mohammad discussing recent changes in writing practices that occurred due to the advent of the computer and the arrival of the digital age.,Poetry,"Eastern Washington State Historical Society. Artifacts Collection. Northwest Museum of Arts and Culture, Spokane, WA.","Ashland, OR",42.1916714,-122.728533,"CTRL+Shift, Center for Digital Inquiry and Learning, University of Idaho Library, https://ctrl-shift.org/",,Image;StillImage,video/mp4,eng,"In Copyright - Educational Use Permitted. For more information, please contact University of Idaho Library Special Collections and Archives Department at libspec@uidaho.edu.",http://rightsstatements.org/vocab/InC-EDU/1.0/,image,/objects/make_believe_005.jpg,/objects/small/make_believe_005_sm.jpg,/objects/thumbs/make_believe_005_th.jpg,,
make_believe_127,"Administration Building, University of Idaho, No. 30",Pacific Photo Co.,1910,"Example locally hosted image item. Photographic postcard of the University of Idaho administration building in Moscow, Idaho.",universities; buildings; campuses; picture postcards,"Spokane Flour Mill Records, 1903–1948. Ms 3. Eastern Washington State Historical Society (Northwest Museum of Arts and Culture). Spokane, WA.","Moscow, Idaho",46.725562,-117.009633,"PG 9, Postcard Collection, Special Collections and Archives, University of Idaho Library",pg_9_12_01bl,Image;StillImage,image/jpeg,eng,,http://rightsstatements.org/vocab/NoC-US/1.0/,image,/objects/make_believe_127.jpg,/objects/small/make_believe_127_sm.jpg,/objects/thumbs/make_believe_127_th.jpg,historic sepia photograph depicting a formal brick and stone building in the College Gothic style,